name,type,eircode,address,lat,lng,email,phone,contact1,contact2,contact3,link,sourceId,,,
P. O'Donoghue (Killarney) Limited,PHA,,"The Medical Hall, Main St, Killarney, Co. Kerry",52.05857,-9.50935,,,,,,,,,,Kerry
Park Road Pharmacy,PHA,,"Countess Centre, Park Road, Killarney, Co. Kerry",52.06011,-9.4937,,,,,,,,,,Kerry
"Pharmacy Department, Kerry General Hospital",PHA,,"Tralee, Co. Kerry",52.26538,-9.68915,,,,,,,,,,Kerry
Reen's Pharmacy (Rathmore) Ltd,PHA,,"West End, Rathmore, Co. Kerry",52.0841,-9.21969,,,,,,,,,,Kerry
Sam McCauley Chemists,PHA,,"Manor West Retail Park, Tralee, Co. Kerry",52.26364,-9.67799,,,,,,,,,,Kerry
Sewell's Pharmacy,PHA,,"1/2 New Street, Killarney, Co. Kerry",52.05923,-9.50967,,,,,,,,,,Kerry
Shanahan's Pharmacy (Castleisland) Ltd,PHA,,"Church Street, Castleisland, Co. Kerry",52.22874,-9.46274,,,,,,,,,,Kerry
Sheahan's Pharmacy,PHA,,"34 Main Street, Killarney, Co. Kerry",52.05895,-9.50911,,,,,,,,,,Kerry
Sheahan's Pharmacy Limited,PHA,,"18 Main Street, Kenmare, Co. Kerry",51.87948,-9.58247,,,,,,,,,,Kerry
Sneem Pharmacy,PHA,,"South Square, Sneem, Co. Kerry",51.83767,-9.89763,,,,,,,,,,Kerry
The Village Pharmacy,PHA,,"Strand Street, Castlegregory, Co. Kerry",52.25506,-10.01984,,,,,,,,,,Kerry
Thomas J. Brosnan Limited,PHA,,"19 Henry Street, Kenmare, Co. Kerry",51.87858,-9.58372,,,,,,,,,,Kerry
Trant's Pharmacy,PHA,,"Park Road, Killarney, Co. Kerry",52.06026,-9.48183,,,,,,,,,,Kerry
Walsh's Pharmacy,PHA,,"Green Street, Dingle, Co. Kerry",52.14065,-10.27141,,,,,,,,,,Kerry
Waterville Pharmacy Limited,PHA,,"Main Street, Waterville, Co. Kerry",51.82723,-10.17181,,,,,,,,,,Kerry
Willms Pharmacy Limited,PHA,,"New Street, Killarney, Co. Kerry",52.05871,-9.51113,,,,,,,,,,Kerry
